{
  "schemaVersion": "pom-contract-v1",
  "page": {
    "name": "LoginPage",
    "route": "/auth/login",
    "capability": "AUTHENTICATION",
    "openMethod": "openLogin"
  },
  "locators": [
    {"id": "usernameInput", "strategy": "name", "value": "username", "role": "input", "elementName": "Username", "stabilityScore": 0.88}
  ],
  "actions": [],
  "assertions": [],
  "coverageGaps": [],
  "rejectedSuggestions": []
}

